{
  "$schema": "https://json-schema.org/draft/2020-12/schema",
  "title": "TaskSpec",
  "type": "object",
  "required": ["id", "objective", "scope", "acceptance", "test_commands"],
  "properties": {
    "id": { "type": "string", "minLength": 1 },
    "repo": { "type": "string" },
    "base_ref": { "type": "string" },
    "objective": { "type": "string", "minLength": 1 },
    "context": {
      "type": "object",
      "properties": {
        "files": { "type": "array", "items": { "type": "string" } },
        "notes": { "type": "array", "items": { "type": "string" } }
      },
      "additionalProperties": true
    },
    "scope": {
      "type": "object",
      "required": ["allowed_paths"],
      "properties": {
        "allowed_paths": {
          "type": "array",
          "minItems": 1,
          "items": { "type": "string" }
        },
        "forbidden_paths": {
          "type": "array",
          "items": { "type": "string" }
        }
      },
      "additionalProperties": false
    },
    "acceptance": {
      "type": "array",
      "minItems": 1,
      "items": { "type": "string" }
    },
    "test_commands": {
      "type": "array",
      "minItems": 1,
      "items": { "type": "string" }
    },
    "limits": { "type": "object", "additionalProperties": true },
    "permissions": { "type": "object", "additionalProperties": true },
    "routing": { "type": "object", "additionalProperties": true }
  },
  "additionalProperties": true
}
